{
  "$schema": "https://json-schema.org/draft/2020-12/schema",
  "$id": "https://lpic-daily.dev/schemas/hint.schema.json",
  "title": "LPIC Daily graduated hint",
  "type": "object",
  "additionalProperties": false,
  "required": ["schema_version", "id", "lab_id", "level", "content_fr", "evidence_impact"],
  "properties": {
    "schema_version": { "$ref": "common.schema.json#/$defs/schemaVersion" },
    "id": { "$ref": "common.schema.json#/$defs/contentId" },
    "lab_id": { "$ref": "common.schema.json#/$defs/contentId" },
    "level": { "type": "integer", "minimum": 1, "maximum": 4 },
    "content_fr": { "type": "string", "minLength": 5 },
    "evidence_impact": {
      "enum": ["none", "minor", "material", "solution-revealed"]
    }
  },
  "allOf": [
    {
      "if": { "properties": { "level": { "const": 4 } }, "required": ["level"] },
      "then": { "properties": { "evidence_impact": { "const": "solution-revealed" } } }
    }
  ]
}
