{
  "schema_version": "1.0.0",
  "id": "lpic1.101.2.boot-journal-persistence.hint-4",
  "lab_id": "lpic1.101.2.boot-journal-persistence",
  "level": 4,
  "content_fr": "Supprime la surcharge qui force Storage=volatile, configure Storage=persistent, crée /var/log/journal, redémarre systemd-journald, exécute journalctl --flush puis :reboot. Vérifie ensuite journalctl -b -1.",
  "evidence_impact": "solution-revealed"
}
