{
  "schema_version": "1.0.0",
  "id": "lpic1.104.5.transfer-team-share-audit.hint-4",
  "lab_id": "lpic1.104.5.transfer-team-share-audit",
  "level": 4,
  "content_fr": "Applique root:project puis 1770 à incoming et 2770 à team, retire le SUID de audit-helper avec un mode final 0755, configure umask 0007 dans /root/.bashrc et crée team/handoff-note depuis bash --rcfile.",
  "evidence_impact": "solution-revealed"
}
