{
  "schema_version": "1.0.0",
  "id": "lpic1.104.5.transfer-team-share-audit.hint-3",
  "lab_id": "lpic1.104.5.transfer-team-share-audit",
  "level": 3,
  "content_fr": "Vérifie séparément 1770 sur incoming et 2770 sur team. Le fichier handoff-note doit être créé depuis un bash chargeant /root/.bashrc avec umask 0007.",
  "evidence_impact": "material"
}
