{
  "schema_version": "1.0.0",
  "id": "lpic1.103.1.shell-scope-history.hint-2",
  "lab_id": "lpic1.103.1.shell-scope-history",
  "level": 2,
  "content_fr": "Une affectation seule reste dans le shell ; export la rend visible aux enfants. unset supprime les deux vues.",
  "evidence_impact": "material"
}
