{
  "schema_version": "1.0.0",
  "id": "lpic1.103.4.redirection-pipeline-repair.hint-3",
  "lab_id": "lpic1.103.4.redirection-pipeline-repair",
  "level": 3,
  "content_fr": "Compare « > fichier 2>&1 » et « 2>&1 > fichier » : 2>&1 copie une destination déjà ouverte.",
  "evidence_impact": "material"
}
