{
  "schema_version": "1.0.0",
  "id": "lpic1.101.1.ramdisk-module-recovery.hint-4",
  "lab_id": "lpic1.101.1.ramdisk-module-recovery",
  "level": 4,
  "content_fr": "Charge brd avec modprobe brd rd_nr=1 rd_size=16384. Crée ext4 sur /dev/ram0, monte-le sous /run/lpic-ramcache, recopie source.txt depuis /var/lib/lpic-ramcache et démarre lpic-ramcache-reader.service.",
  "evidence_impact": "solution-revealed"
}
