{
  "schema_version": "1.0.0",
  "id": "lpic1.101.3.graceful-maintenance-transition.hint-1",
  "lab_id": "lpic1.101.3.graceful-maintenance-transition",
  "level": 1,
  "content_fr": "Regarde l'état des deux unités applicatives et ce qui arriverait au point de reprise du worker lors d'une terminaison forcée.",
  "evidence_impact": "none"
}
