{
  "schema_version": "1.0.0",
  "id": "lpic1.104.7.fhs-search-recovery.hint-4",
  "lab_id": "lpic1.104.7.fhs-search-recovery",
  "level": 4,
  "content_fr": "Le dossier catalog doit être le périmètre de l’index. Avec updatedb, vérifie les options de création d’une base privée et de visibilité, puis utilise locate pour retrouver le guide. Pour le rapport, examine type, which et whereis.",
  "evidence_impact": "solution-revealed"
}
