{
  "schema_version": "1.0.0",
  "id": "lpic1.104.5.rwx-dispatch-access.hint-2",
  "lab_id": "lpic1.104.5.rwx-dispatch-access",
  "level": 2,
  "content_fr": "Le droit x permet de lancer un fichier mais de traverser un répertoire. Un utilisateur non privilégié doit pouvoir accéder au rapport sans le modifier.",
  "evidence_impact": "none"
}
