{
  "schema_version": "1.0.0",
  "id": "lpic1.104.2.filesystem-maintenance.hint-2",
  "lab_id": "lpic1.104.2.filesystem-maintenance",
  "level": 2,
  "content_fr": "df -P et df -Pi mesurent blocs/inodes ; du -sk mesure l'arborescence. Un dd plus grand que le volume doit provoquer ENOSPC.",
  "evidence_impact": "material"
}
